<?xml version="1.0" encoding="UTF-8" ?>
<canales xmlns:xsi="http://www.w3.org/2001/XMLSchema-instance" xsi:noNamespaceSchemaLocation="television.xsd">
    <canal nombre="hola" numero="1">
        <programacion dia="Lunes">
            <programas>
                <programa>
                   <duracion>45</duracion>
                    <titulo>uyy</titulo>
                    <descripcion>jfkdsajkfjdklas</descripcion>
                    <clasificacion>3</clasificacion>
                    <capitulo>1</capitulo>
                </programa>
            </programas>
        </programacion>
        <anuncios>
            <anuncio>
                <marca>marca</marca>
                <duracion>3</duracion>
                <horario>2</horario>
            </anuncio>
        </anuncios>
        <programacion dia="Martes">
            <programas>
                <programa>
                    <duracion>45</duracion>
                    <titulo>uyy</titulo>
                    <descripcion>jfkdsajkfjdklas</descripcion>
                    <clasificacion>3</clasificacion>
                    <capitulo>1</capitulo>
                </programa>
            </programas>
        </programacion>
        <anuncios>
            <anuncio>
                <marca>marca</marca>
                <duracion>3</duracion>
                <horario>2</horario>
            </anuncio>
        </anuncios>
        <programacion dia="Miercoles">
            <programas>
                <programa>
                    <duracion>45</duracion>
                    <titulo>uyy</titulo>
                    <descripcion>jfkdsajkfjdklas</descripcion>
                    <clasificacion>3</clasificacion>
                    <capitulo>1</capitulo>
                </programa>
            </programas>
        </programacion>
        <anuncios>
            <anuncio>
                <marca>marca</marca>
                <duracion>3</duracion>
                <horario>2</horario>
            </anuncio>
        </anuncios>
        <programacion dia="Jueves">
            <programas>
                <programa>
                    <duracion>45</duracion>
                    <titulo>uyy</titulo>
                    <descripcion>jfkdsajkfjdklas</descripcion>
                    <clasificacion>3</clasificacion>
                    <capitulo>1</capitulo>
                </programa>
            </programas>
        </programacion>
        <anuncios>
            <anuncio>
                <marca>marca</marca>
                <duracion>3</duracion>
                <horario>2</horario>
            </anuncio>
        </anuncios>
        <programacion dia="Viernes">
            <programas>
                <programa>
                    <duracion>45</duracion>
                    <titulo>uyy</titulo>
                    <descripcion>jfkdsajkfjdklas</descripcion>
                    <clasificacion>3</clasificacion>
                    <capitulo>1</capitulo>
                </programa>
            </programas>
        </programacion>
        <anuncios>
            <anuncio>
                <marca>marca</marca>
                <duracion>3</duracion>
                <horario>2</horario>
            </anuncio>
        </anuncios>
        <programacion dia="Sabado">
            <programas>
                <programa>
                    <duracion>45</duracion>
                    <titulo>uyy</titulo>
                    <descripcion>jfkdsajkfjdklas</descripcion>
                    <clasificacion>3</clasificacion>
                    <capitulo>1</capitulo>
                </programa>
            </programas>
        </programacion>
        <anuncios>
            <anuncio>
                <marca>marca</marca>
                <duracion>3</duracion>
                <horario>2</horario>
            </anuncio>
        </anuncios>
        <programacion dia="Domingo">
            <programas>
                <programa>
                    <duracion>45</duracion>
                    <titulo>uyy</titulo>
                    <descripcion>jfkdsajkfjdklas</descripcion>
                    <clasificacion>3</clasificacion>
                    <capitulo>1</capitulo>
                </programa>
            </programas>
        </programacion>
        <anuncios>
            <anuncio>
                <marca>marca</marca>
                <duracion>3</duracion>
                <horario>2</horario>
            </anuncio>
        </anuncios>
    </canal>
</canales>